{
  "credentialId": "urn:uuid:9bca26a6-d31c-45e0-91fd-c2bf7f0b8a01",
  "statusPurpose": "revocation",
  "status": "active",
  "sourceRegistry": "tl:registry:demo-primary",
  "keyId": "tl:key:registry-demo-2026-01",
  "updatedAt": "2026-09-07T11:30:00Z",
  "jws": "eyJhbGciOiJFZERTQSIsImtpZCI6InRsOmtleTpyZWdpc3RyeS1kZW1vLTIwMjYtMDEiLCJ0eXAiOiJKT1NFIn0.eyJjcmVkZW50aWFsSWQiOiJ1cm46dXVpZDo5YmNhMjZhNi1kMzFjLTQ1ZTAtOTFmZC1jMmJmN2YwYjhhMDEiLCJrZXlJZCI6InRsOmtleTpyZWdpc3RyeS1kZW1vLTIwMjYtMDEiLCJzb3VyY2VSZWdpc3RyeSI6InRsOnJlZ2lzdHJ5OmRlbW8tcHJpbWFyeSIsInN0YXR1cyI6ImFjdGl2ZSIsInN0YXR1c1B1cnBvc2UiOiJyZXZvY2F0aW9uIiwidXBkYXRlZEF0IjoiMjAyNi0wOS0wN1QxMTozMDowMFoifQ.KWPZ3X-87CndQOxBOPcQPZ7oNkKbCSm-0kPNX9mmeWyeaAdF-gE_xCyOiVyfH0SXgZ_Wf3e2g2oUSZaH-cKdAw"
}
